{"$schema":"https://json-schema.org/draft/2020-12/schema","type":"array","items":{"type":"object","required":["slug","title","shortDescription","status","publishedWorkCount","showInFilters","showInNavigation","landingPage","externalDomain"],"properties":{"slug":{"type":"string","pattern":"^[a-z0-9-]+$"},"title":{"type":"string","minLength":1},"shortDescription":{"type":"string","minLength":1},"status":{"enum":["incubating","active","archived"]},"publishedWorkCount":{"type":"integer","minimum":0},"showInFilters":{"type":"boolean"},"showInNavigation":{"type":"boolean"},"landingPage":{"type":["string","null"]},"externalDomain":{"type":["string","null"]}},"additionalProperties":false}}

